{
  "delegation_id": "impl-milestone.add-slugify.slice-1.implementer",
  "plan_position": "phase-1/milestone-1/slice-1",
  "depends_on": ["plan.add-slugify.lead-planner"],
  "resolved_prompt": "You are the Implementer in loops/IMPLEMENT_MILESTONE.md running one vertical slice under TDD. Milestone `add-slugify`: implement bin/_probe_slugify.py::slugify to satisfy the pinned acceptance test exactly. Red before green; edit only files in implementation_scope.",
  "chosen_tier": "fast",
  "tier_price": {"currency": "USD-per-Mtok", "basis": "illustrative", "input": 0.8, "output": 4.0},
  "decision_signals": {
    "source": "triage:trivial-fast-path",
    "task_tier": "light",
    "confidence": 0.95,
    "reasoning": "Single new pure function, additive-only, deterministic executable gate; cheapest capable tier under cost_optimized."
  },
  "gate": {
    "command": "python3 -m unittest tests.test_probe_slugify -v",
    "cwd": "REPO_ROOT",
    "pass_criteria": "exit code == 0 and unittest reports OK with 0 failures/0 errors",
    "baseline_polarity": "fail"
  },
  "upstream_artifacts": [
    {"kind": "repository_state", "pinned": {"vcs": "git", "head": "79d449e612517390cd3a62da60416d9d0e2f36ce", "dirty_files": []}},
    {"kind": "redqueen_prompt", "status": "absent"},
    {"kind": "pinned_acceptance_test", "path": "tests/test_probe_slugify.py", "sha256": "0000000000000000000000000000000000000000000000000000000000000000"}
  ],
  "outcome": {"status": "pass", "escalated": false}
}
